{"change_seq":"5","changes":[{"after":null,"before":{"display_name":"P.read","kind":"function","signature":"func read()","span":{"byte_end":30,"byte_start":0}},"identity":{"guards":[],"kind":"function","name":"read","scope":[{"kind":"protocol","name":"P"}]},"kind":"removed"}],"coverage":{"after":{"state":"complete"},"before":{"state":"complete"}},"language":"typescript","language_version":"typescript.v1","projection_version":"interface.v1","status":"ready"}
