{"change_seq":"5","changes":[{"after":{"display_name":"f","kind":"function","signature":"function f(): void","span":{"byte_end":18,"byte_start":0}},"before":null,"identity":{"guards":[],"kind":"function","name":"f","scope":[]},"kind":"added"}],"coverage":{"after":{"state":"complete"},"before":{"state":"absent"}},"language":"typescript","language_version":"typescript.v1","projection_version":"interface.v1","status":"ready"}
