{"change_seq":"5","changes":[{"after":null,"before":{"display_name":"bgone","kind":"function","signature":"function bgone(): void","span":{"byte_end":52,"byte_start":30}},"identity":{"guards":[],"kind":"function","name":"bgone","scope":[]},"kind":"removed"},{"after":null,"before":{"display_name":"gone","kind":"function","signature":"function gone(): void","span":{"byte_end":21,"byte_start":0}},"identity":{"guards":[],"kind":"function","name":"gone","scope":[]},"kind":"removed"},{"after":{"display_name":"chg","kind":"function","signature":"function chg(x = 2): void","span":{"byte_end":25,"byte_start":0}},"before":{"display_name":"chg","kind":"function","signature":"function chg(x = 1): void","span":{"byte_end":85,"byte_start":60}},"identity":{"guards":[],"kind":"function","name":"chg","scope":[]},"kind":"signatureChanged"},{"after":{"display_name":"anew","kind":"function","signature":"function anew(): void","span":{"byte_end":81,"byte_start":60}},"before":null,"identity":{"guards":[],"kind":"function","name":"anew","scope":[]},"kind":"added"},{"after":{"display_name":"znew","kind":"function","signature":"function znew(): void","span":{"byte_end":51,"byte_start":30}},"before":null,"identity":{"guards":[],"kind":"function","name":"znew","scope":[]},"kind":"added"}],"coverage":{"after":{"state":"complete"},"before":{"state":"complete"}},"language":"typescript","language_version":"typescript.v1","projection_version":"interface.v1","status":"ready"}
