{"change_seq":"5","changes":[{"after":{"display_name":"move(at:)","kind":"method","signature":"func move(at p: Point)","span":{"byte_end":40,"byte_start":0}},"before":{"display_name":"move(from:)","kind":"method","signature":"func move(from p: Point)","span":{"byte_end":40,"byte_start":0}},"identity":{"guards":[],"kind":"method","name":"move","scope":[]},"kind":"signatureChanged"}],"coverage":{"after":{"state":"complete"},"before":{"state":"complete"}},"language":"swift","language_version":"swift.v1","projection_version":"interface.v1","status":"ready"}
