{"change_seq":"5","changes":[{"after":{"display_name":"f","kind":"function","signature":"function f(a: string, b: string): void","span":{"byte_end":68,"byte_start":30}},"before":{"display_name":"f","kind":"function","signature":"function f(a: string): void","span":{"byte_end":57,"byte_start":30}},"identity":{"guards":[],"kind":"function","name":"f","scope":[]},"kind":"signatureChanged"}],"coverage":{"after":{"state":"complete"},"before":{"state":"complete"}},"language":"typescript","language_version":"typescript.v1","projection_version":"interface.v1","status":"ready"}
