{"change_seq":"5","changes":[{"after":{"display_name":"f","kind":"function","signature":"function f(x = 2): number","span":{"byte_end":40,"byte_start":0}},"before":{"display_name":"f","kind":"function","signature":"function f(x = 1): number","span":{"byte_end":40,"byte_start":0}},"identity":{"guards":[],"kind":"function","name":"f","scope":[]},"kind":"signatureChanged"}],"coverage":{"after":{"state":"complete"},"before":{"state":"complete"}},"language":"typescript","language_version":"typescript.v1","projection_version":"interface.v1","status":"ready"}
