{"change_seq":"5","changes":[{"after":null,"before":{"display_name":"trace","kind":"function","signature":"func trace()","span":{"byte_end":40,"byte_start":0}},"identity":{"guards":["DEBUG"],"kind":"function","name":"trace","scope":[]},"kind":"removed"},{"after":{"display_name":"trace","kind":"function","signature":"func trace()","span":{"byte_end":42,"byte_start":0}},"before":null,"identity":{"guards":["!(DEBUG)"],"kind":"function","name":"trace","scope":[]},"kind":"added"}],"coverage":{"after":{"state":"complete"},"before":{"state":"complete"}},"language":"typescript","language_version":"typescript.v1","projection_version":"interface.v1","status":"ready"}
