{"change_seq":"5","changes":[{"after":{"display_name":"b","kind":"function","signature":"function b(): void","span":{"byte_end":38,"byte_start":20}},"before":null,"identity":{"guards":[],"kind":"function","name":"b","scope":[]},"kind":"added"}],"coverage":{"after":{"state":"complete"},"before":{"state":"complete"}},"language":"typescript","language_version":"typescript.v1","projection_version":"interface.v1","status":"ready"}
