{"change_seq":"5","changes":[{"after":null,"before":{"display_name":"oldName","kind":"function","signature":"function oldName(): void","span":{"byte_end":24,"byte_start":0}},"identity":{"guards":[],"kind":"function","name":"oldName","scope":[]},"kind":"removed"},{"after":{"display_name":"newName","kind":"function","signature":"function newName(): void","span":{"byte_end":24,"byte_start":0}},"before":null,"identity":{"guards":[],"kind":"function","name":"newName","scope":[]},"kind":"added"}],"coverage":{"after":{"state":"complete"},"before":{"state":"complete"}},"language":"typescript","language_version":"typescript.v1","projection_version":"interface.v1","status":"ready"}
